Query|Document
Download Free Games Jun '20|released 06/05/2020 with digital distribution increasing in popularity, free-to-play games have become more and more widespread. You can find free games for just about any genre youre interested in, all completely legally.
9/11/37 court Lumina on Harvest Moon DS|Lumina spends a lot of her time playing the piano at her grandmother Romana's mansion in the northwest of the valley. Romana is fairly well-to-do and has been trying to raise Lumina to be a proper lady, but her granddaughter is looking for a different kind of life Written 09/11/37
2/18/12 get 10,000 Additional G's in Harvest Moon Another Wonderful Life|If you are running low on cash in Harvest Moon: Another Wonderful Life, then check out this article. You will also find out how to get tons of random seeds, crops, dairy products, etc Published 02/18/12
Do Tricks on Mario Kart Wii 2029 September|published 09/02/2029 looking to take your Mario Kart Wii game to the next level? Successfully performing tricks during a race can give you a quick speed boost, allowing you to blow past your opponents.
Dominate Mario Kart Online Racing 2036 Mar|released 03/19/2036 after completing the Grand Prix and polishing your Time Trial times in Mario Kart, you find that there's nothing to do except one thing. Online Racing.
2/11/28 disable the Green Light on a Thrustmaster T.16000M Joystick|posted 02/11/28 the Thrustmaster T.16000M is a great budget joystick for flight sims enthusiasts. However it comes with a green light that illuminates the base of the stick whenever you use it.
6/21/18 do a Lets Play Walkthrough| Have you ever seen those amazing gaming videos on YouTube? Well here is how to make your own. Written 06/21/18
Nov of 2026 do Codecs Conversation With the Snake and Starfox Team|In Super Smash Bros. Brawl there is a secret way to call up Otacon, mei ling or campbell with snake. Also using fox, wolf or falco you can hear the battle created 11/02/2026
1/24/44 develop a Game|Published 01/24/44 generally, a game must include creative backgrounds, thriller plot, immense graphics, and super sound. This Guide will show you how to effectively plan your game content development project, staff your game development team, and will walk you through all stages from idea development to product finalization and release.
Mar 2003 dominate Slither.io with a Team Strategy|published 03/17/2003 are you looking to rule the leaderboard in Slither.io? With a team approach, you can develop a strategy that lets you work together to take over the leaderboard.
Install Ib, the Free Horror Adventure Game Apr '43|"Know the game ""Ib""? Want to play it, but don't know how to install it? Just read on. ( Sadly, since the game is made using RPGMAKER, it won't work on Mac.) Posted 04/13/2043"
February 2022 do Heart Surgery in Surgeon Simulator |Published 02/11/2022 surgeon Simulator, released in 2013, is a sim game in which the main character Nigel Burke performs life-saving surgical procedures on passive patients.
7/11/20 install a Torrent Game|Torrents are one of the most popular ways to share files online. You can find virtually any game through various torrent sites online. Installing a game you download via torrent is a little more involved than installing a purchased game, as you'll need to crack the copy-protection on the game Released 07/11/20
Install an ISO Game File on a Windows PC 2022 November|published 11/03/2022 versions of Windows 8 and beyond provide a built-in capability of mounting ISO image files on a virtual drive. Versions of Windows 7 and require third-party software in order to create a virtual disk drive capable of mounting ISOs.
8/30/48 not Get Scared While Playing Survival Horror Games|created 08/30/48 ever wanted to play a survival horror game but were too scared? You'd definitely expect to be, considering that is the aim of a horror game! However, sometimes it's nice to be able to be play a game and not be terrified of every single thing that moves, so here's a guide on how to not get so scared!
05/5/38 install Oolite on Linux|Posted 05/05/38 oolite is an open source and cross-platform space game, inspired by the classic Elite. Oolite will run happily on Windows, Mac OS, and Linux. This article will guide you through installing it on Linux.
9/19/22 increase Performance of Any Game or Application (Windows)|created 09/19/22 this article will increase the speed of any video game (counter-strike source, tf2, or any other computer game) OR application that you just want to go smoothly.
2016 May make a Game Guide|Created 05/24/2016 This article will show you how to write a small walkthrough you can give to your friend who just can't seem to get further than level one. 
last month current date: 8/18/2034 increase Your Skill in Shooting Games|Stuck in a corner? Bad guys waiting to shoot your scared head off your spine? Tired of getting shot on the back as soon as you re-spawn? Then read this article I made released 07/01/34
November 2043 identify Sabjorn's Silent Partner in Skyrim|posted 11/11/2043 identifying Sabjorns silent partner is one of the objectives that you need to do in order to complete the Dampened Spirits quest in Elder Scrolls V: Skyrim.
3/2/00 get Through the Lab in Stick RPG | Do you play Stick RPG 2? Do you want to finish/win it? Then read this article! Posted 03/02/00
12/22/39 make a Video Game in an Hour with Reality Factory| This tutorial will guide you step by step in making a bare bones 3d video game with Reality Factory in hopefully less than an hour. written 12/22/39
April of 2036 improve Your Multiplayer Gaming Skills|Created 04/23/2036 gaming has taken a competitive twist ever since Doom brought friends and foes together in an all out deathmatch. Now games such as Halo and Counter-Strike bring multiplayer to a whole new level, and revolve around the multiplayer gaming scene.
Go on Computer All Night Without Your Parents Noticing April '11|"You want to play your games all night. But your parents are just in the next room. You're wondering ""how do I play without them noticing?"" Here are some devious ways to miss your sleep written 04/19/2011"
Christmas 2010 improve Your Skills at Video Games| This How To will teach you how to become better at video games. Created '11 New Year's Day
Add a Cyber Pet on Your Blogger Sidebar 2023 Jun| People like animals, but sometimes you just can't have one. So here's the next best thing, a virtual pet on your blogger sidebar. Published 06/11/2023
Adopt Dragons on Dragon Cave August of 2015| Dragon Cave is free-to-use website where you can adopt and raise your very own virtual dragons. Everything starts with your first egg. Published 08/03/2015
February 12 accept a Special Happiness Chest on Evony|Posted 02/13/47 sometimes people in your alliance are generous enough to give everyone in the alliance a chest. The Special Evony Happiness Chest is one of them and they are the most common chests, (there are other chests too, those chests are mainly for holidays and only holidays).
03/29/39 be Good at iMob Online|Written 03/29/39 An easy guide to becoming the greatest iMob player ever!!! (Without having to pay for respect points!!) 
Be Famous on Bin Weevils 06/11/18| Have you ever wanted to be famous on Bin Weevils? Well now's your chance! published 06/11/18
Be a Noob on Amazing World 2015 Jan|"written 01/04/2015 amazing World is often looked down upon by Webkinz and Club Penguin players but is still very entertaining. This will show you how to be a noob. Surprisingly, most of what we call ""noobs"" are very well loved."
Ace Jetman 2015 Jan|written 01/04/2015 want to ace one of the most addicting and fun game on Facebook? Jetman is a really simple game when you look from the top. but to get a good high score and be on the top spot against your friends take dedication, practice and skill.
Jun '29 map for Garry's Mod With Source Sdk|Written 06/26/2029 garry's Mod mapping is very similar to HL2 mapping (if not identical), unless you're using custom entities specified for G.MOD (Garry's Mod) only, in which case would make the map unique to gmod.
Get the Fun Out of Garry's Mod Online middle of last year current date: 10/10/2040| This article will teach you how to get the most out of Garry's Mod online multiplayer. released 05/01/39
6/15/28 make an Automatic Turret in Garry's Mod|posted 06/15/28 this automatic turret automatically aims at players. It's a good auto turret for your first. This project is for intermediate players, so you need to be familiar with basic wire mod tools.
8/13/02 choose the Perfect Match for Your Waja|Waja is a virtual pet game in which you care for wolf-like creatures called Wajas. It can be difficult to find the match that gives you beautiful puppy Wajas Posted 08/13/02
Make a Timed Explosive in Garry's Mod 9/02/38|Created 09/02/38 For this project, you will need wire installed with your Garry's mod. 
Become Better at IMVU Oct 2020|Written 10/05/2020 IMVU (Instant Messaging Virtual Universe) is an online entertainment site that uses avatars to enable interaction. 
Become an EB Games Member 3/3/10|Published 03/03/10 So, you have been playing games from EB Games for years, and then all of a sudden you here that you can become a member. Here's how! 
Dec 2003 become an Arc Tracer in Elsword|Arc Tracer is one of the job change class, aside from Psychic Tracer, for the character Add, the start of the path to become a Mastermind class in Elsword Published 12/17/2003
01/16/43 become Successful in Horseland World| Being successful can't be done by simply paying $80 for a premium, you need to develop skills and devotion. Published 01/16/43
Feb '43 come Back from Behind in Heroes of the Storm|There will be matches in Heroes of the Storm where your opponents gain a huge early-game advantage over your team. Maybe they were able to get ten kills in the first two minutes of the game Posted 02/23/2043
Create a Region on NationStates 7/2/03|NationStates is a nation simulation game where you can run your own fictional country just the way you want. As your nation's power grows, you may find that influence over other nations isn't enough Posted 07/02/03
Complete Site Tau in SOMA Jan 7|You have reached Site Tau, the location where the ARK is located. There are numerous data mine intercoms in various rooms located on the map to further understand the backstory SOMA has to offer posted 01/16/12
Create a Good Yard in Backyard Monsters Jan 7|Backyard Monsters is a popular game that is getting more users by the minute. It is featured on Facebook's social networking website. The only problem is that anyone else on the game can attack your yard, and you may be defeated posted 01/16/12
Create a Game for Kongregate May of 2027| So, you want to develop a game for Kongregate, eh? Well, I reckon you've come to the right place. Posted 05/26/2027
March 2043 delete Your Pottermore Account|created 03/19/2043 do you want to delete your account with Pottermore? Previously, the popular wizarding website had not made it easy to remove yourself. However, now there is no longer a need to send them letters or emails to get it deleted.
July '15 create a Battle Net Clan| Create a successful clan with this guide, it covers actual clan making through clan site making. Released 07/12/2015
Apr '48 complete The History of Television Quest on VFK|There are many educational quests on Virtual Family Kingdom, commonly abbreviated VFK. Learn how to complete the History of Television quest by reading this article posted 04/16/2048
Delete Your Projects on Scratch 05/19/35|Published 05/19/35 scratch is a programming site allowing users of all ages and ability to create projects. Some people, however, may be embarrassed by earlier projects or have some other need to delete them.
Determine Bounty Prices in Mobsters 8/2/10| This article will tell you how bounty prices are determined in the Mobsters application. released 08/02/10
Do a Special Trick or Stunt in Need for Madness August 29|Published 08/05/ lots of people play and enjoy this game. But in the game there might be glitches and strange stuff. I found this weird stunt that shows how to launch Formula 7 out of the starting line like a rocket!!!
November '32 determine Bounty Prices in Bloodlines|Released 11/10/2032 unlike other social gaming applications, Bloodlines calculates a bounty or hit list price in a different way. Instead of using income as part of the equation, the game uses the amount of wins a person makes.
Dig the Rocks at the Explorer's Camp in Dizzywood January 29| There is a pile of rocks in the Explorer's Camp area of Dizzywood and if you can move them you can get a big reward. Posted 01/02/07
August '03 dominate at New 1000 AD| A quick guide to the steps of learning to become a dominate player at New 1000 AD. Created 08/16/2003
Do Well on Fantage 2017 June|Posted 06/22/2017 Fantage is an online virtual world. Are you in a dilemma as to how to do well on Fantage? This quick guide will teach you how to do well on Fantage. 
Do the Tutorial on Forge of Empires 05/28/28| Once you registered on Forge on Empires, it will automatically direct you to the tutorial on the game. This page will help you go through it. Posted 05/28/28
"Do a ""Chip in"" in PangYa 05/28/28"| A vague overview on how to chip-in on the golf game PangYa. Posted 05/28/28
Create Your Own Mario Level with Level Editor on Super Mario Flash 7/30/01|created 07/30/01 if you love playing Mario games, you're sure to enjoy building your own Mario worlds! Using the Level Editor on Super Mario Flash, you can create levels from scratch - no programming experience needed.
Create an MMORPG Guild 2023 Apr|Creating a guild in an MMORPG (Massively Multiplayer Online Role-playing Game) has many perks. You can have help completing quests, leveling up, or just simply having people and friends to talk to as you adventure Created 04/14/2023
Jun of 2045 defeat Protector in Epic Battle Fantasy |written 06/24/2045 Protector is an Average boss in Kitten Kingdom Ruins. This article will show you how to Defeat and Access it. 
07/31/42 deal 5,000 Damage in Epic Battle Fantasy |created 07/31/42 epic Battle Fantasy 3 is mostly all about Battling monsters to access places or treasures. Dealing 5,000 damage to a Single monster is pretty impressive.
"Jun 4 defeat Pandak ""Baby"" Panay"|" Find it hard to defeat Pandak ""Baby"" Panay in Just Cause 2? Read below to find out how! Published 06/12/27"
Create an Inquisitor Character Jun 2035|Posted 06/04/2035 A quick guide on how to create decent characters for Inquisitor. 
Oct '07 create an Account on Syrnia|created 10/23/2007 Syrnia is a free, online text-based RPG that you should definitely try out. Here is how to create an account on Syrnia. 
Create an Account on Petpet Park 06/30/03|" Have you ever heard of the game called ""Petpet Park"" and you want to join it? Here are the steps to joining the site! posted 06/30/03"
July 2025 create a Vending Machine in Manyland|Published 07/01/2025 Manyland is a game where you can create object and meet people online. In this tutorial we will be creating a vending machine. 
Complete Infernal Abyss Dungeon in Aura Kingdom 9/12/46|Aura Kingdom is an online role playing game set in a fantasy world. Your character can interact with other users, battle mystical creatures, and embark on quests Written 09/12/46
September '40 complete Ace's Tasks on SuperSecret|Tasks are a great way to earn Spenders (money) and Age Points (experience) on SuperSecret. Learn how to complete Ace's tasks by reading this article Released 09/08/2040
2/27/34 collect Fishbucks and Fishcoins in Fishao|As you might know, Fishao is an online game where fishbucks and fishcoins is the in-game currency. At some point in the game, you would have ran out of either fishbucks or fishcoins Written 02/27/34
Complete Site Delta in SOMA Oct 2013|posted 10/15/2013 after you crash in CURIEs escape submersible, you will be located in Site Delta. This vast location offers useful information hidden throughout the site.
Complete Kenji's Tasks on SuperSecret 2001 August|Published 08/11/2001 tasks are a great way to earn Spenders (money) and Age Points (experience) on SuperSecret. Learn how to complete Kenji's tasks by reading this article.
November 2044 create a Successful Alliance in Battle Dawn|Battle Dawn is one of the biggest online, multiplayer strategy game where rivals compete for the dominance of the world. To do this, people form alliances released 11/01/2044
"Complete ""Escape Your Friend's House"" August 2010"|"written 08/10/2010 ""Escape Your Friend's House"" is a room-escape game. It is the sequel to ""Escape The House"". "
8/07/25 code Guild Layouts|Posted 08/07/25 tired of searching the hundreds of pre-made layouts found on the web? Is nothing matching what you are really looking for? Why not try your hand at making your own Neopets Layout?
Nov of 2006 draw on Drawball|created 11/18/2006 You've come across Drawball.com and would like to contribute your artwork , but you don't know how to get started. Here's a guide to help. 
Collect Energy in Pirate Galaxy 7/04/28|Released 07/04/28 Here is how to collect energy in Pirate Galaxy. 
Jun of 2039 cheat or Hack in Super Crazy Guitar Maniac Deluxe | How to cheat in Super crazy guitar maniac deluxe 2 with Cheat Engine! posted 06/16/2039
Cheat on Scary Maze Feb 2032|"Always like getting attention by a high-pitched scream but you know about the only maze game that is talking about called the ""Scary Maze"" game is a screamer but there is a cheat in the game published 02/22/2032"
2016 June choose an Online Roleplaying Game|World of Warcraft, Guild wars, Runescape, Adventure Quest! So many to pick. How do you get through the duds and into the gold? Just follow this guide to find the right one for you posted 06/13/2016
Chose the Best Rakeback Deal for You Nov 2042|If you play online poker getting the best possible cash back deal is essential to maintaining a healthy bankroll. There are now lots of rakeback deals available but it may not be the highest rakeback percentage that is the best one for you Posted 11/13/2042
5/9/31 cheat Using Chaos Blast in Sonic Smash Bros. Beta|Sonic Smash Brothers may be a good game to play but its hard too. Shadow, Supersonic, and Supershadow can use Chaos Blast as their special move, which is strong but you can only use it twice Created 05/09/31
Earn Lots of Oddles on Gsn 01/28/02|Gsn.com is a fun place where oddles is the currency. And the best part? It's all free! With your oddles you can enter contests, buy cool products, and even play games Published 01/28/02
Sep '23 get a Grand Fantasia Bot|This is a small and detailed step by step showing how to get a Grand Fantasia Bot. Visit Sources and Citations below to download the bot. This guide is going to be your best friend while you play Grand Fantasia released 09/25/2023
Equip an Item in Brunelleschi: Age of Architects Jun of 2050|If you've finally done something that's earned you a piece of equipment but you can't seem to move if from the inventory to your character, this article will explain what you need to do released 06/26/2050
Get a Date on Bin Weevils Sep 2006|Everyone knows that it's important to get a boyfriend or girlfriend on a cool site like Club penguin or Bin weevils. Today I am going to tell you how to find one on Bin weevils! released 09/03/2006
Get 0 Points in Papa's Hot Doggeria Jan 2023|Published 01/07/2023 papa's Hot Doggeria is a game where you have to grill a sausage perfectly, put it in the right bun with the right toppings on top, serve the right drinks and snacks, and all that has to be done as quickly as possible to earn the highest number of points from the customers as possible.
Get a Diploma on HiDolls Jan 2023|Published 01/07/2023 Did you know you can send your doll to High School to get a diploma? Then, she can get a job! Follow these steps to braininess... 
Get Easy Money on Total Miner Forge Feb '15| Here is a way to make money on total miner forge. released 02/06/2015
5/11/28 finish the Puzzles in Virtual Villagers |Posted 05/11/28 virtual Villagers 4 is a very popular casual game by Last Day of Work, and can be very tricky. Here is a guide to (hopefully) make it a bit easier. :P
04/01/17 get F.E.A.R. Combat for Free|First Encounter Assault Recon, more commonly known as F.E.A.R., is a horror first person shooter for the PC. Monolith Productions, the people who made F.E.A.R., decided to release F.E.A.R. Combat (the multiplayer segment) for free online Published 04/01/17
9/6/37 get the Best Ever Ending on Grow Island|released 09/06/37 If you want to have the most epic ending ever then this article/guide will help you. 
2/7/18 get Unbanned from Chatroulette|Published 02/07/18 chatroulette is a popular anonymous video chat site, but sometimes, you might find yourself banned for no apparent reason and without warning. If you want to get unbanned from Chatroulette, here are a few different tactics you can try.
2/7/18 guild Battle in Last Chaos|Published 02/07/18 in Last Chaos, the Guild Battle system allows Guilds to challenge each other in a Guild versus Guild fight and is used by Guild Leaders to challenge another Guild Leader to a team based battle.
Go Into Space on Planet Cazmo Jul '45|Created 07/08/2045 planet Cazmo is a children's online virtual world and going into space is a popular and fun thing to do here is how you fulfill your dream as an astronaut!
Have a Cool Room in Nicktropolis January 2019|posted 01/10/2019 Are you new to Nicktropolis? Not sure what to do? Continue reading this wikiHow article to find out! 
Jan 2002 grow Crops on Hay Day|Created 01/26/2002 hay Day involves growing crops to feed animals and to make farm products for sale to visitors, stores and in your own market stall at the front of the farm.
6/09/09 make a Zombie Dragon at Dragon Cave|Undead Dragons, also known as Zombies, are a special breed of dragon only obtainable by users killing (or purposefully allowing to die) their adults and/or hatchlings, and then attempting to revive them on the 31st of October (Halloween) Published 06/09/09
Sep 2048 make a Weevil on Bin Weevils|Binweevils.com is a free virtual world where you can create your own avatar which is a weevil. With tons of new people playing, it's a great time to make your own weevil! Published 09/20/2048
Jul of 2021 join and Enjoy Whyville|written 07/14/2021 are you just getting started on Whyville? Whyville.net is a virtual, free chat site for people around the ages of 8-16. It's very hard to be a newbie on chat sites, so read carefully and you will do just fine.
6/3/45 get Your Own Ykeshan Bear in Everquest |"posted 06/03/45 in the new Everquest 2 expansion pack, Everquest 2: The Shadow Odyssey , you can receive a special Ykeshan Bear for buying the game! Once you have the bear it can adventure alongside you AND becomes your mount at level 20 so you don't have to pay big bills to get a ""not as cool looking"" mount from a merchant!"
Make a Wormhole Route in Empire Universe August of 2016|Created 08/09/2016 in the Looki game Empire Universe, sometimes you have to go to a very far away system, to trade, help a friend or just mine that juicy asteroid. If the system is over five parsecs away, it might take over an hour to go there and move back, consuming lots of fuel in the process.
Make a Nick.Com or Nicktropolis Account 2016 May|Released 05/15/2016 Wondering what Nick.com or NickTropolis is like? This is where you can find out how to make an account. It's really very easy. 
2029 April loot in Dead Frontier|Posted 04/23/2029 (Major update/article revamp, November 2012) 
Make a Strong Mybrute Brute Aug of 2050|Published 08/01/2050 my brute is a casual web game sensation. Every single person who registered always wanted to have the strongest brute out there. Here are a few tips to make a strong brute.
07/18/17 make a Hill for Tabletop Gaming (E.G Warhammer)|What to have some scenery to put in your battlefield but can't afford the excellent pre-built ones? Dont worry you can make your own for a fraction of the cost published 07/18/17
Make a Good Line Rider Track May '50|released 05/25/2050 Not so good at Line Rider? Are you just a beginner? This is a page for you. 
December 2010 make a Good Platform Racing (PR2) Level|Posted 12/19/2010 if you haven't heard of it yet, Platform Racing 2 (PR2 for short) is an exciting free online game on Jiggmin.com. The game offers an excellent opportunity to race, chat, make friends, and of course, make your own custom levels for everyone to play.
5/09/17 make a Lot of Gold in Godfinger|posted 05/09/17 godfinger is a free online-based app on the Apple App store. You get to create your own little planet, have your own followers work for you, and buy things for your planet.
Make a Giant Tree That's Like a House in Survivalcraft 03/02/35|Want to make a giant house that's like a house? Follow this simple guide and you'll be at it in no time at all! Please note this is for Survivalcraft not Minecraft! created 03/02/35
05/25/10 level up Your Overall Level on Smallworlds|" Want quick overall leveling on the virtual game SmallWorlds? Here's a little How-to on ""How to"" level up on SmallWorlds. Posted 05/25/10"
5/04/15 level up Fast on Silkroad|published 05/04/15 Have you ever had trouble leveling up on Silkroad? This guide will help you level up fast in no time at all (up to level 20). 
Level Up in Elder Scrolls Online 09/02/46|Are you trying to get your character's level up in ESO? Unlike previous games, your level is not determined by the number of skill increases but instead by the amount of experience gained overall created 09/02/46
Look Like a Ninja on Arcanists (F2P) 09/02/46| Ninjas are awesome, so it makes sense that everybody awesome likes ninjas. If you want to look like a funkalicious ninja on Arcanists, read on. created 09/02/46
