Query|Document
Upgrade Your People in Final Fantasy I 3/07/03|published 03/07/03 this article is being directed from a Dawn of Souls view. It is not a good idea to do this with the NES version, though it would still work. Read on for the Steps.
4/24/02 speak Al Bhed of Final Fantasy X and X| Learn to speak Al Bhed. If you don't know what Al Bhed is, it is a language made up by the creators of Final Fantasy X and Final Fantasy X-2. Posted 04/24/02
Jan '25 level Up Easily in Final Fantasy VI Advance|created 01/24/2025 do you need some quick levels to help you on a boss, but the problem is you don't know a good training place? If so then this article will show you a great place to gain levels!
07/15/29 get Through Final Fantasy Iv on the Ds Pt. Iv|created 07/15/29 OK. Here is the next Pt. to the walk-through. Follow these quick steps to get through the second part of the caves. 
Obtain Doomtrain in Final Fantasy VIII 07/29/12|Doomtrain is a special and optional summon that only appears exclusively on Final Fantasy VIII. To get Doomtrain, you need to summon this particular GF, or Guardian Force, instead of acquiring it through battle or story-related progress posted 07/29/12
Rush a Mule in Diablo II (Hardcore) 2024 February|There are lots of instructions on how to get a level one mule into Hell, but most of them are on Softcore and they involve the mule dying. This is not something you want to happen in Hardcore Created 02/26/2024
Build a Panic Room in Dont Starve June of 2012|created 06/09/2012 by some miracle, youve managed to survive the first couple weeks in Dont Starve, only to hear growling just before you are assaulted by quite a few creatures youre not familiar with.
9/08/41 catch Rabbits in Dont Starve|Rabbits are probably one of the more versatile resources in Dont Starve. While their meat is one of the least filling food in the game, you could use it for various things, like making jerky, feeding the pigs, and even use the rabbits themselves as crafting materials! Written 09/08/41
9/08/41 camp Underground in Don't Starve|Once you get a good footing in your playthrough and have survived long enough to accumulate quite a lot or resources, you might want to consider moving underground at some point Written 09/08/41
March of 2032 cook Frog Legs in Dont Starve|posted 03/13/2032 sometimes, when exploring in the game Don't Starve, you might come across a nice little pond in the middle of the grasslands or the forest, when suddenly, frogs start attacking you!
Play a Sorcerer in Diablo 07/19/29|Written 07/19/29 This is just a simple guide for beginners and intermediate players. 
Multiseat Diablo III with Softxpand 12/27/26|Created 12/27/26 have 2 people play Diablo III from the same PC at the same time using their own accounts, keyboards and mice. A very neat solution for LANs without the need for so many PCs.
Sep of 2043 kill a Super Mutant Overlord in Fallout |Created 09/09/2043 it's rare. It really is. But sooner or later, you're going to face a Super Mutant Overlord, and it ain't gonna be pretty. Luckily for you, killing them is so much more simple than you may have feared.
Jun of 2046 calculate Bonus Points for a Recipe in Don't Starve|Sometimes, you just want more value for your meals. Usually because youre dead broke and starving, at least if youre playing Dont Starve. Fortunately, your trusty Crock Pot can give you much more value for every individual ingredient when you make Crock Pot dishes created 06/10/2046
Rock at Diablo 9/4/27|posted 09/04/27 diablo 2 may appear at first to be a technical in-depth game, but once you understand in simple terms what to look out for, your characters will be dying less.
Dec '37 hack a Computer Terminal in Fallout |Hacking is an essential skill in Fallout 3's Capitol Wasteland, as terminals can give you access to anything from a bit of story to fancy loot. Terminals can control turrets, and may be essential for some quests written 12/17/2037
Jun 15 kill a Feral Ghoul Reaver in Fallout |Created 06/09/08 feral Ghouls are one of the most recognizable threats of the wasteland. It's not common to run into a Feral Ghoul Reaver, but it is possible. You need to be prepared to defend yourself in the event of an attack by Feral Ghoul Reavers.
Apr 2020 install FOSE|Written 04/10/2020 fOSE, or Fallout Script Extender, is a third-party application for the PC version of Fallout 3. Fallout Script Extender allows gamers to create and edit mods (short for modification) that alter the game's programming code, adding or changing features that are not included in the original game package.
Apr 2020 make a Fallout Fan Film|Written 04/10/2020 fallout is one of the greatest open-world RPG game series. It is deep, influential, and powerful. Has it ever inspired you to make a short Fallout fan film?
5/01/00 go to and Survive the Glowing Sea in Fallout |Published 05/01/00 this article will teach you how to survive the Glowing Sea, one of the many unique places that make Fallout 4 a truly mind blowing game. It is full of dangerous creatures, and packed with radiation!
Steal the Rhino Tank in Grand Theft Auto V Mar 2047|Created 03/26/2047 a Rhino tank is the the crown jewel of mayhem in GTA 5, but many strategies rely on using huge sums of money to achieve this goal. With the right approach and careful execution, stealing a Rhino tank is well within your reach.
Get to Rivet City in Fallout Mar 2047|Created 03/26/2047 making your way to the Rivet City settlement can be a dangerous event for new players. Being the largest city in the Wasteland, its hard to resist the trip.
Get the Ghoul Ecology Perk in Fallout Oct 2040|Written 10/12/2040 Are you tired of getting your limbs torn off by Ghouls? There's a way to fight them off with ease. Want to learn how? Keep reading to find out. 
Nov 12 take the Sport Bike from the Thief in GTA V|The random event in GTA V that tasks you with chasing down a motorcycle thief gives you the option to either keep the Pegassi Bati 801 or return it to the owner released 11/12/37
2017 Apr stop a Car Theft in GTA V|When playing Grand Theft Auto V, you yourself could also become a victim of car theft. Other online players could walk up to your car and take it with ease Created 04/19/2017
Get the Xenotech Expert Perk in Fallout Sep of 2048|As you may or may not know, players in Fallout 3 may choose an enhancement perk whenever they level up. However, there is a way to get quest perks without leveling up Created 09/16/2048
Use the Weapon Wheel in GTA V May 2024|Grand Theft Auto V offers a plethora of different weapons, allowing you to play however youd like. Whether youre a fan of sniping enemies from the distance or like to get up close and personal with a sawed-off shotgun, GTA V will not disappoint released 05/23/2024
2023 Mar shoot at the Shooting Range in GTA V|Nearly all the missions in Grand Theft Auto V involve combat, which means youll be doing plenty of shooting. If youre a bit rusty with a gun, or if your character has low shooting stats, it might be time to stop by the shooting range Posted 03/02/2023
4/5/02 sell Cars in Grand Theft Auto 5 Online|written 04/05/02 gTA V has a multiplayer mode called GTA Online that lets users play the game with 16 to 30 other players. Here, players can do several multiplayer-type games like deathmatches and races, among others.
March 2020 take Cover in Grand Theft Auto (GTA) |This wikiHow teaches you how to hide behind cover in Grand Theft Auto V. These instructions apply to both the traditional third-person version and the remastered first-person version of GTA 5 published 03/16/2020
7/12/07 save Yourself in the Alley in GTA V|Some random events in Grand Theft Auto V are an opportunity to help someone, but will also put you in harms way. One such event takes place in an alley in La Mesa Published 07/12/07
06/2/07 rob the Security Vans in GTA V|Early on in Grand Theft Auto V, it can be a bit difficult to come across money, as most of your income will be coming from heists. If you need a quick way to get easy money, you can always resort to petty thievery; robbing drug stores, mugging citizens, etc posted 06/02/07
2037 March play Tennis in GTA V|created 03/11/2037 rockstar has done a surprisingly good job turning a GTA V mini-game into an engaging activity thats as fun (if not more so) than other fully-fledged tennis games on the market.
2/1/03 rob People at ATMs in GTA V|posted 02/01/03 one of the many quick crimes you can do to earn some money in Grand Theft Auto 5 is robbing ATMs. This petty crime will earn you anywhere from a few tens to a hundred dollars.
01/17/09 play Golf in GTA V|Created 01/17/09 one of the many mini-games you can play inside the world of Grand Theft Auto 5 is golf. It lets you and your character take part in a short game of the sport in a 3-D course right in Los Santos.
Feb 2013 play Grand Theft Auto 5 (Story Mode)|Grand Theft Auto 5 (GTA V) is back and its Story Mode is more massive than ever before. Know the ways of Los Santos and complete this epic open world adventure with Franklin, Trevor, and Michael Written 02/04/2013
2031 Oct participate in the Hao Street Races in GTA V|created 10/22/2031 many heists in Grand Theft Auto V require a fair amount of racing through the streets. Whether youre tailing a target or trying to escape from the cops, being able to speed through Los Santos is an essential skill.
9/28/18 rescue a Woman from a Crash in GTA V|Random events in Grand Theft Auto V usually result in a monetary reward. However, some result in more useful rewards, such as gaining a new heist crew member Created 09/28/18
Participate in Sea Races in GTA V Aug 2032|If youve already dominated the street races in Grand Theft Auto V, then its time to hone your skills in the ocean. Sea races are done on a Jet Ski, and feel completely different than speeding down the road in a car created 08/17/2032
Modify Cars in GTA V 01/7/49|Written 01/07/49 grand Theft Auto V contains a huge assortment of vehicles. Most vehicles can be customized with performance enhancement, body work, and effects. Customization takes place at several Los Santos Customs outlets in the southern portion of Blaine County and at Beekers Garage in the northern portion of the county.
Get the Pipboy 3 Billion on Fallout New Vegas 5/02/13|Are you tired of looking at that ugly, beat up Pipboy you get when you start the game? Here is how how to get the Pipboy 3 Billion (pimped-out version of the normal Pipboy) Posted 05/02/13
Get the Alien Blaster in Fallout: New Vegas Sep '04|written 09/02/2004 The Alien Blaster is powerful. It is a true wonder weapon, but where is it and how do you get it? Read this article to learn how. 
Get to Mr. House's Chamber in Fallout: New Vegas 11/18/28|The time has come for you to choose a side. Legion, NCR, Independent, or House. Let's just assume that you're not choosing House. How do you take him out of the picture Published 11/18/28
8/20/27 get an Idolized Reputation at Goodsprings in Fallout: New Vegas|Written 08/20/27 if there's one thing you may have noticed that's unique about Fallout: New Vegas, it is probably the reputations you can earn with individual settlements.
Find Edgar's Chainsaw in Final Fantasy VI June of 2019|written 06/07/2019 edgar's Chainsaw is one of his most powerful tools. It deals strong damage to one enemy and has a 25% chance to instantly kill that enemy; however, the puzzle you need to complete in order to get your hands on the chainsaw is nothing short of a daunting task.
Beat Fallout 3 New Vegas Faster 08/06/23|published 08/06/23 This is how to beat the game faster and saves you a lot of time. This is a short article but will save you at least 7 missions. 
Clear Freeside of Thugs in Fallout: New Vegas December '18| It's all too easy when entering Freeside to be swarmed by thugs. It's time to put an end to the muggings. Published 12/20/2018
Eliminate the Deathclaws at Quarry Junction in Fallout: New Vegas Oct of 2010|published 10/23/2010 Quarry Junction. It's hard to miss. It's the only place crawling with Deathclaws! How do you get rid of them? Read on to find out. 
02/9/09 get Master Materia in Final Fantasy VII|Final Fantasy VII is a wonderful game. Having a single material that contains all the magics of that family is essential for excelling near the end of the game released 02/09/09
05/24/01 defeat Neslug in the Monster Arena in Final Fantasy X|So, you've beaten nearly all the monster's at the Monster Arena in FFX, but you can't beat this huge slug. Well, here is a strategy that helped me, and will hopefully help you too released 05/24/01
1/16/39 get Onion Knight in Final Fantasy III|posted 01/16/39 Hello there. Today you will learn how to get Onion Knight in FFIII. It is super easy - all you need to do is follow these steps: 
Form a Good Party in Final Fantasy XI 01/8/30|In Final Fantasy XI, there comes a point in the game where it is mandatory to have to associate ones self with others in order to advance. This is a comprehensive guide on how to make a successful party for new players, or people not too familiar with how to make a good party written 01/08/30
Make a Holy Shock Paladin in Diablo 2048 Jun|released 06/26/2048 diablo 2 is a hard game to progress through and sometimes you'll need a little help. With the help of this guide, however, you can create a very powerful character.
Defeat Maat Monk on Final Fantasy XI 2048 Jun|"released 06/26/2048 the Maat fight for Final Fantasy XI must be completed in order to level to 75. Every job has their own unique fight. This is a guide for the job, ""Monk""."
Build a Barbarian in Diablo III Mar '07|Diablo III is an action role playing game set in a fantasy, demonic world where your character must defeat the Lord of Terror - Diablo. Barbarians are savage wanderers who never flinch from close-quarters combat written 03/10/2007
Get Power Armor Training Without Joining the Brotherhood of Steel in Fallout Dec 2009|Let's face it, fighting the Enclave before you get power armor training sucks. You have almost no chance against Enclave tech! So, how can you even the odds posted 12/22/2009
Change the Game Language in Diablo II Lord of Destruction July 2009|"released 07/19/2009 The great game Diablo 2 has no ""change language"" option available. You have to do it at the beginning. And beginning = installation! "
October of 2037 defeat Gi Nattak in Final Fantasy VII|Written 10/03/2037 Gi Nattak, that annoying villain who continually possesses your characters, can be defeated in a very unusual way. 
Get the Best Armour on Fallout 2/03/24|Tired of being killed by Super Mutants, Ghouls, and Raiders because of bad armour? Look no further than this article. The armour is stuff of legend and practically awesome posted 02/03/24
Get Jericho As a Companion in Fallout 2/03/24|Are you hopelessly alone in the Capitol Wasteland? Need some backup while crusading the wastes? Then read on to learn how to get the former Raider Jericho to join your side posted 02/03/24
6/8/20 get the Alien Blaster in Fallout |Ever since Fallout 3, the Alien Blaster has been a recognizable symbol of wasteland power. With the ability to disintegrate even the most powerful of enemies, the Alien Blaster is a weapon to behold Written 06/08/20
6/8/20 get Into National Guard Armory in Fallout | What's inside the armory of the National Guard Depot? How can you access the treasures hidden within? Read on to find out. Written 06/08/20
Get Fawkes As a Companion in Fallout April of 2050| Facing an army of Enclave can be tough. Where can you get some heavy-duty backup? Why, in the dark confinements of Vault 87, of course. Written 04/16/2050
Fast Travel on Fallout March '49|Created 03/05/2049 This is a very simple guide on how to use fast travel in Fallout 3. It's an option in Fallout 3 to get around the huge world fast. 
Learn to Fly in GTA V 10/08/09|Learning how to fly in GTA 5 is very easy and takes only about an hour. Flying makes for a more exciting game, and can be really fun. Read on to learn how to fly, mission by mission Written 10/08/09
Participate in Off Road Races in GTA V 11/12/44|In Grand Theft Auto V, off road races take place on rough terrain in Blaine County. After winning a race, you will be rewarded $500 and the next race will be unlocked released 11/12/44
01/5/48 install Grand Theft Auto V (GTAV) on Xbox |posted 01/05/48 gTA V is the largest Grand Theft Auto game so far and comes with 2 DVD discs for Xbox 360. Luckily, thanks to the way the game is installed, you'll never need to swap discs after the initial installation.
01/5/48 make Franklin Clinton from GTA 5 Look Like Snoop Dogg|posted 01/05/48 Do you want Franklin to look like Snoop Dogg? 
May '16 help the Victim of a Construction Accident in GTA V|Some of the random events in Grand Theft Auto V dont give much in way of rewards. However, all random events contribute to having 100% completion. Thus, while the reward for helping a construction worker escape from an accident is only +2 to your Driving skill, its still helpful Released 05/19/2016
8/8/32 kill the Shop Robbers in GTA V|created 08/08/32 two random events in Grand Theft Auto V require you to kill the robbers of two different shops. These events can be done in any order and are available to any playable character.
Kill the Redneck Border Patrol in GTA V 2 years ago current date:04/06/22|created 01/01/20 there are three random events in Grand Theft Auto V in which youre followed and shot at by rednecks who call themselves the border patrol. Your reward for killing them is the money and ammo they drop.
Have Infinite Money in Grand Theft Auto 5 (GTA V) October 2027|released 10/17/2027 there are no straightforward money cheats in GTA V, but with the right strategy you can get more money than you know what to do with. [1] While a few infinite money exploits did sneak in there, you need the unpatched version to use them, and they're probably slower than making money on the in-game stock market anyway.
Dec '50 kill the Rogue Altruists in GTA V|Posted 12/06/2050 the Altruists are a religious cult comprised mainly of old men in the gaming world of Grand Theft Auto V. They hate technology and believe that all generations after them are the root of societys issues.
Mar 17 help Drunk Drivers in GTA V|Aside from the several missions that players can enjoy in GTA V, there are also Random Events that players can participate in. Helping drunk drivers in GTA V appears at two instances as a Random Event in the game Published 03/07/15
Help the Victim of a Countryside Gang Fight in GTA V 4/25/33|Created 04/25/33 in Grand Theft Auto V, a random event called Countryside Gang Fight can be completed if you save a drug dealer from being killed by members of the Lost MC.
January 25 win at EA Sport's Fifa Soccer 2005 |There's no such thing as an easy goal, right? Well, at least without cheats. Wrong. Follow these steps to win in the following games (all made By EA Sports): FIFA Soccer 2005, FIFA Soccer 2006, FIFA Soccer World Cup Germany 2006 Published 01/04/
October 2050 update FIFA 13 on the PS|created 10/14/2050 prior to the release of FIFA 14, EA Sports released automatic updates for FIFA 13 whenever they became available. Though EA Sports no longer releases updates for FIFA 13, you may still be able to install the latest game and roster updates if its been awhile since you played FIFA 13.
Succeed As a Manager on FIFA 2/28/32|posted 02/28/32 Manager mode is very difficult on FIFA 08. Before starting note this works on all the FIFA games. 
Score from Midfield in FIFA 05/2/10| It is possible to score from midfield in FIFA 14. You just have to know what to do, when. Released 05/02/10
Play FIFA on the Wii Oct 2019|Posted 10/16/2019 while it may not be as flashy as its Xbox 360 and PS3 cousins, FIFA on the Wii is still a rock-solid experience and full of depth. Like all FIFA games, its best played with friends.
Score Easy Goals in a FIFA Game Nov '47|released 11/23/2047 Do you want to be a master in FIFA game then just follow these steps. 
Play FIFA 02/4/35|If you have played FIFA 07, 08 or 09, then playing FIFA 10 will be quite easy. If you are new to FIFA games, this will guide you to becoming a better player Created 02/04/35
Score a Goal Using a 1 Star Team Against a 5 Star Team 02/4/35|Losing and struggling is not an option in FIFA 11. Defeat the monsters of football with a quick and easy step! Are you always losing or are you trying to get a goal against a 5 star team Created 02/04/35
Score a Goal in FIFA 9/25/36| Scoring goals in FIFA 13, like in real football is how you win games. This article explains the easiest/most effective way to score posted 09/25/36
Play FIFA 2008 Manager Mode Apr '16|Fifa 08 is a great game to play, but it does get old just playing other people after a while. Maybe you should try manager mode to make it even more fun! Written 04/12/2016
last year current date: 3/25/2017 play FIFA |Released 01/01/16 fIFA 12 has made some significant changes to the way the game is played compared to previous versions, so newbies and veterans alike have a lot to learn before they can be effective.
January 2 play FIFA 09 on the Nintendo Wii| FIFA 09 is great on the Nintendo Wii. If you don't know how to play it, read this! written 01/19/13
Defeat Kefka in Final Fantasy VI July of 2030|GAME OVER . If this is a familiar screen you see every time you try to fight Kefka, the game's final boss, or the boss at Narshe, then this guide will hopefully give you some tips on victory! created 07/16/2030
Defeat Nemesis in Final Fantasy X 2020 August| So, you made it by every boss in the Monster Arena. But can you take on this deadly fiend? created 08/23/2020
09/18/21 defeat Emerald Weapon in Final Fantasy |Emerald Weapon is likely the most difficult boss in Final Fantasy VII. However, he is also an optional 'superboss', so only the most skilled or completionist players should take him on created 09/18/21
Manually Control a Goalkeeper in FIFA Feb of 2026|"Since EA Sports introduced ""Be A Pro"" mode in FIFA 08, it went through a painstakingly slow and gradual process of tweaking this mode. In its fourth season, it finally completely changed its goalkeeping controls, and allowed ""Be A Goalkeeper"" mode created 02/25/2026"
05/11/38 defeat Dark Aeons|Below are steps you may follow to prepare yourself in battling Dark Aeons in the International version of Final Fantasy X. Dark Aeons are optional bosses that surpass the main antagonist of the game's storyline Written 05/11/38
Apr '15 defeat Diablos in Final Fantasy VIII|FFVIII marks Diablos' first major appearance in the franchise as a Guardian Force (summon). His magic attacks are gravity-based, meaning they inflict damage equal to a certain percentage of the opponent's current HP Created 04/21/2015
Apr '15 defeat Black Elemental in Final Fantasy X |Well, you managed to get to Cloister 40 of the dungeon Via Infinito in Bevelle. But you must face this powerful fiend of the Elemental class. This article will tell you the easiest way to beat him Created 04/21/2015
05/08/23 break a Final Fantasy XI Addiction|"The definition of ""addiction"" is the state of being enslaved by something that is psychologically or physically habit-forming (such as narcotics), to such an extent that to discontinue the habit or practice can lead to severe trauma created 05/08/23"
Sep of 2019 convert Final Fantasy X/X 2 Into D&D Stats| Frustrated by how video game creatures can be converted into 3.5 Dungeons and Dragons stats? Well, don't fear. Published 09/18/2019
Mar 2001 defeat Azi Dahaka in Final Fantasy X |created 03/13/2001 if you couldn't figure out the music puzzles in the Farplane in Final Fantasy X-2, or you just don't want to be bothered doing them, defeating a Azi Dahaka is the only way to continue through the Farplane.
Mar 2001 defeat Angra Mainyu in Final Fantasy X |created 03/13/2001 Angra Mainyu is a really tough boss that is difficult to take on. Here's how, and as long as it is, you will do it after a couple of tries. 
12/27/48 beat Every Boss in Final Fantasy X |Want to defeat tough bosses like Baralai?Or do you just want to defeat that mega tough enemy that looks like a small turtle holding a knife and lamp?If you do, you picked the right article!However, you must already have two or three special dresspheres released 12/27/48
middle of 2001 be a Scholar in Final Fantasy XIV|Being a healer in video games may seem very easy, but there are many things that make them tough to play as, especially at higher levels when there are more numbers flying around the screen! Released 17 days ago current date:07/30/01
March '50 use the Xbox 360 Mic As a Mic in Guitar Hero|So, the other day I was playing Guitar Hero on the Xbox 360 with my brother, and we only have the guitar for it. So we messed about and found a way of using the microphone we use for chatting to people, as the microphone for Guitar Hero! published 03/14/2050
March '50 use Cheats in Guitar Hero | If you've never used cheats on GH 3 it can be a little tricky. Read on for an explanation of the process and several cheats. published 03/14/2050
Two Hand Tap on Guitar Hero 08/01/36|created 08/01/36 we all need a little help in Guitar Hero some time or another, and two hand taping is the way to go. It can help you on hundreds of songs, like: Through The Fire And Flames, Knights Of Cydonia, One, Cliffs of Dover and many more.
Sing in Guitar Hero February of 2027|released 02/06/2027 Some versions of Guitar Hero have more instruments than guitar. In this tutorial you'll get some tips how sing in Guitar Hero. 
Play Guitar Hero 2 Using the Regular Controller February of 2027|released 02/06/2027 so you and your friend want to play Guitar Hero 2 multiplayer, but you only have one guitar, or you have the game but no guitar. No problem! You can just use a regular controller.
