Query|Document
February of 2021 beat Raam in Gears of War|published 02/05/2021 general RAAM is an ugly and evil guy. First lieutenant to Queen Myrrah, he is the Final Boss of Gears of War. Yet he is hard to defeat, so if you're so frustrated that you need help, no problem.
Get Good on the Gears of War Shotgun June of 2038|published 06/11/2038 Always turn a corner and see your body blasted to bits? Not anymore! Own all with these tactics and become the lead killer! 
06/20/38 complete All 50 Waves of Horde on Gears of War |Created 06/20/38 This guide should contain helpful advice on how to complete all 50 waves of horde on Gears of War 2. 
Dec 2007 beat Guitar Hero |released 12/08/2007 Do you want to beat guitar hero 2? Well, I'm going to tell you how. 
Dec 2007 crabwalk in Gears of War|released 12/08/2007 This article is on how to Crabwalk in Gears of War. 
Beat Jordan on Expert (in Guitar Hero) March '37|"Okay... So you've beaten every song on expert so far, when suddenly you come to a roadblock. You're probably thinking, ""That's a crazy solo!"" and that's okay Written 03/26/2037"
Escape from an Old Style POW Camp 2024 October|Created 10/03/2024 you never know. One day, you could be stuck in a POW (Prisoner of War) camp, hundreds of miles from home, or safe territory. If you want to be the next Roger Bartlett, you are in the right place.
Christmas 2027 be Good at Gears of War Online|Written end of last year current date: 12/25/2028 This is a short guide explaining tactics and methods of winning Gears of War matches online. 
11/4/35 chainsaw Effectively on Gears of War|released 11/04/35 anyone can chainsaw someone on Gears of War. You'll most likely get abuse for being unskilled, but if you can do it well enough they'll bow at your feet and you'll be crowned the Chainsaw King!
Use Smoke Grenades Effectively in Gears of War 11/05/17|Created 11/05/17 smoke grenades don't do anything, right? They don't do damage and so surely they can't be of any use to you? Wrong! Smoke grenades are a vital part of Gears of War and can confuse, fool, and humiliate your opponents.
Be Good at Gears of War July 2017|Gears of War is one of the most unique, and challenging, shooters in modern memory. The third-person perspective means that you need to adapt to a more movement-based style of play than most shooters, ducking, dodging, and running around enemies to get one powerful shot off Published 07/20/2017
Play Grand Theft Auto 5 Online July 2017|Grand Theft Auto 5 (GTA V) offers its fans an open world online experience where players can complete missions together or compete against each other Published 07/20/2017
Play Five Nights at Freddy's Christmas 2016|written end of last year current date: 12/28/2017 five Nights at Freddy's is a 2014 indie survival horror game and is often considered one of the scariest games of the year. Do you have the guts to play it?
Be Good at Gears of War 2 Multiplayer Aug 2001|Released 08/16/2001 gears of war 2 has finally come out! Veterans of the first game may dominate you, but no more. Here are a few tips that will help you survive. Remember some of gameplay has been tweaked so it will play different from the first gears.
Be a Better Driver in GTA V Aug 2001|Released 08/16/2001 do you want to play a gamemode in which you have to hide from a helicopter, or you want to make a video of some kind and you need to become as good as a NPC Driver?
Understand the Five Nights at Freddy's Timeline 6/4/07|Published 06/04/07 the Five Nights at Freddy's series is a complex and quizzical game. Not the game itself, but the intricate story dedicated to the haunted animatronics that hunt for you 5 nights a week.
Beat Horde Mode on Insane 6/4/07|Published 06/04/07 horde mode is an insanely fun and suicidal way to get the seriously 2.0 achievement, or vent your rage, whichever it is, the main goal of any gears 2 junkie, is to beat it on the insane difficulty.
Play Five Nights at Freddy's 11/12/34|Created 11/12/34 five Nights at Freddy's 2 is a popular indie survival horror game by Scott Cawthon, first released in 2014. It is a prequel to the first game, Five Nights at Freddy's.
Summon Golden Freddy in Five Nights at Freddy's 7/26/16|written 07/26/16 golden Freddy is a secret animatronic in the 2014 survival horror game, Five Nights at Freddy's. If he kills you, he will crash your game (PC) or freeze it (Android &amp; iOS).
Not Be Scared of Five Nights at Freddy's 7/26/16|written 07/26/16 five Nights at Freddy's is an indie horror game series that took the world by storm. Its concepts, lore, and gameplay have inspired many games like it.
Nov 2031 get the Puppet to Kill You in Five Nights at Freddy's |posted 11/17/2031 Are you a FNaF fan? Well, then you'll want to experience all of the jumpscares in the game. So here is how to get The Puppet's jumpscare in FNaF 2! 
Mar '14 catch a Bike Thief in GTA V|released 03/07/2014 while enjoying Grand Theft Auto V, you are thrown off your bicycle and are forced to figure out what just happened to your character. Before you know it, you can see your bike speeding away from you.
09/16/45 beat Night 5 of Five Nights at Freddy's|released 09/16/45 night 5 of Five Nights at Freddy's is the last night of the main 5 nights, so it makes sense it should be hard. Once you know the winning strategy for this night, it'll just take some practice to get it right.
1/02/00 beat Night 6 of Five Nights at Freddy's| The sixth night on Five Nights at Freddy's can be hard and annoying. There is a way, however, to increase your chances of surviving the night. Released 01/02/00
1/02/00 win at Halo Wars| Hello! If you're here, chances are you're looking for tips on how to dominate Halo Wars; if so, you've come to the right place. Released 01/02/00
2011 March use the Most Powerful of Weapons in Halo PC|Created 03/15/2011 how to Use the Most Powerful of Weapons in Halo PC to your advantage. Have you ever wondered how those players do it? How they have a pistol or a sniper and you have a rocket and somehow they manage to kill you every time you go in contact?
2006 April win in Halo|Created 04/08/2006 quickly becoming one of the most popular console video games, Halo is here. Let's hope that your relationships aren't based on Halo skills, or we'll have a lot of work to do.
Make Grand Theft Auto Easier Oct '33|written 10/06/2033 Read this article to see how to do well on a Grand Theft Auto game. 
06/27/49 hijack or Steal a Car in GTA: LCS|The Grand Theft Auto (GTA) series is overall quite nice to play. In the GTA series, you will need to do some illegal jobs such as murder, hit man jobs and other crimes written 06/27/49
"July 2038 make the Right Decision in ""the Holland Play"" and ""Blood Brothers"" in Grand Theft Auto "|Released 07/13/2038 in both of the missions mentioned above, you have a choice of killing one person or another, but only one of them. This guide will help you make the right choice.
08/15/33 make Big Money in the GTA V Stock Market|written 08/15/33 one of the many ways you can earn cash in Grand Theft Auto 5 is through the stock market. You can buy shares from in-game fictional companies and sell it for large profits.
08/15/33 get out of the Army Base With the Apache in Grand Theft Auto: Vice City|written 08/15/33 This article will show you how to get out of the army base - by cheating. 
Intimidate the Gang in GTA V 1/10/08|Gang Intimidation is a random event in Grand Theft Auto V, and is available only to Michael and Trevor. Completion of the Complications mission is required to unlock this random event Published 01/10/08
Snipe in Halo PC on Blood Gulch Jun 2015|Halo is a popular FPS game, even for PC, and blood gulch is probably one of the best multiplayer maps. this guide will teach you exactly how to snipe with the sniper rifle, pistol, and other weapon combo's created 06/14/2015
Dec '31 defeat the Yiazmat in Final Fantasy XII|Final Fantasy XII is the best Final Fantasy game built by Square Enix. It has the most refined battle system of real time. Although it has a story, there is one goal all players wants to do Posted 12/15/2031
Add Custom Songs to Guitar Hero 3 PC 04/01/24|created 04/01/24 this wikiHow assumes that you already have Guitar Hero 3 PC installed on your computer, and that you can get GH3PC to run without problems. You will also have to download software in order to add custom songs to the game.
"Beat ""One"" on Expert in Guitar Hero 04/01/24"|"created 04/01/24 are you struggling with Metallica's ""One"" on Expert in Guitar Hero III due to that really hard solo with all the super fast triplets? Here's a few tips on how to survive:"
Feb of 2011 go on a Rampage in Grand Theft Auto| Rampages are great fun in GTA and an awesome thing to do if you're bored with the missions or just want something different to do! posted 02/13/2011
Add Songs to Guitar Hero 2044 Sep| This set of instructions will allow you to edit your Guitar Hero disc and let you add songs that aren't originally in Guitar Hero. Posted 09/09/2044
Battle in Guitar Hero III: Legends of Rock 2044 Sep|Playing songs skillfully in Guitar Hero III: Legends of Rock is important. However, if you wish to make complete progress in the career mode, you must learn to battle effectively in Boss Battles Posted 09/09/2044
Beat Free Bird on Guitar Hero 2 (Expert) November of 2042|"Created 11/22/2042 so Your On your Career mode on expert and get to the end hoping to beat it, but then You Reach one of my uncles favorite song and hit guitar solo A and (Bink Bink Dong Bonk Thud Blink)""Song Failed""."
9/18/43 beat Any Song on Guitar Hero/Rock Band| You have been practicing and practicing, but you just can't get that song beat! Read this wiki and you may finally 'get it'. created 09/18/43
Be Better on Guitar Hero World Tour Drums 10/12/46| Playing Drums on Guitar Hero World Tour is more easy that it looks. I'll teach you how to play expert, even if you are always playing on easy. posted 10/12/46
Sep '34 play Guitar Hero|"Written 09/01/2034 guitar Hero is a rhythm-based game for the PC, PlayStation 2, Nintendo Wii, PlayStation 3, and Xbox 360. You play a ""guitar"" in time with many well known tracks."
Sep '34 hack Five Nights at Freddy's |Written 09/01/2034 did you make it to night five on Five Nights at Freddy's 2 (FNAF2), only to somehow lose your saved game and have to start all over from the beginning?
Beat Night 2 of Five Nights at Freddy's August 2031|Created 08/11/2031 nightmarish animatronics are becoming more active now as Night 2 comes around. Try not to get gobbled up in the night as attacks become more frequent and more sounds can be heard creeping throughout the darkness.
Oct '00 beat Night 2 of Five Nights at Freddy's: Sister Location|"Written 10/08/2000 sister Location is the latest installment of the ""Five Nights at Freddy's"" series. Night 2 is the first night in which you will be in danger of the animatronics, and you must perform multiple tasks to complete the night."
Beat Five Nights at Freddy's: Sister Location 08/09/47|Sister Location is the latest installment in the popular survival horror series, Five Nights at Freddy's. Unlike the first four main games, in this one you will be performing different tasks on each night, so you can't use the same strategy every time created 08/09/47
Beat Night 4 of Five Nights at Freddy's 08/09/47|Three nights can barely prepare you for the ferocity of the nightmares during Night 4. All the subtle cues from the nightmare animatronics should be well known and understood by this point as things really start to heat up in preparation for Nightmare Fredbear created 08/09/47
Beat Night 1 of Five Nights at Freddy's 2013 Oct| Many people have trouble with Five Nights at Freddy's, but this article will help you get past night one. written 10/05/2013
Mar 2009 beat Golden Freddy Mode in Five Nights at Freddy's: Sister Location|"20/20/20/20 Mode has become almost a staple for Five Nights at Freddy's games. Each installment of the indie horror franchise has included ""bonus nights"" for players to attempt published 03/24/2009"
Beat Five Nights at Freddy's Oct 2048|created 10/04/2048 ever wondered how to survive Five Nights at Freddy's 2? Tired of many animatronics killing you every time? Don't worry, this article will give you all the steps you need in order to survive the second Five Nights at Freddy's game.
"November 2046 tell if You Are a ""Noob"" in Halo"|Maybe you've blasted a few Covenant brutes in your time, but are you up to Spartan standards? The Halo series for the XBox gaming console offers some of the most popular multiplayer action in history published 11/16/2046
Beat Five Nights at Freddy's 03/28/49| This is a quick guide that will show you how to beat the popular Indie horror game, Five Nights at Freddy's. Written 03/28/49
Play Halo Well 5/05/09|Written 05/05/09 Have you ever wanted to make your name one that everyone knows on Halo PC? If so, you have come to the right place. 
Play Halo on the PC March of 2050|Written 03/17/2050 halo: Combat Evolved on PC is significantly different than the Xbox version. The most seasoned Halo veterans of the Xbox may have a hard time adjusting to the differences of the PC.
Sep of 2012 stick a Plasma Grenade to Yourself in Halo|In the action game Halo, you lose points blowing yourself up with a plasma grenade. However, it's still fun and sometimes playing for points just seems so part of the system Published 09/14/2012
Rule in Halo 2 or 3 on Multiplayer or Splitscreen 2021 Mar| Halo is a very fun game but it is not very easy if you keep getting sniped or 'splattered'. Written 03/13/2021
October '26 pwn in Halo for Noobs|Rocket-whores, banshee noobs, spawn killers etc get the better of you? Here are a few pointers to help you get back at them and rack up your kill count Posted 10/21/2026
Jul 15 no Scope in Halo| This is how to use the Sniper Rifle, DMR, or Focus Rifle without using the zoom function. Created 07/09/
Oct '25 play Single Player (Solo) Maps in Halo Ce|created 10/22/2025 Scenario - You've just gotten a brand new awesome map for a solo Halo CE game. But you can't access it. Just follow these steps to do so! 
January '49 mod in Halo PC|Halo is quickly becoming one of the most popular games available. This wikiHow will show you many of the things you can mod in the PC version of the game, including the useful tools which are available for download published 01/09/2049
Kill Flood on Halo 1 and 2044 August| Oh no, you need to destroy Flood! What do you do? Here's what you do! posted 08/02/2044
Make Rockets Circle Around a Warthog in Coagulation 12/7/24| This is how to make a rocket circle around a Warthog in Halo 2. Fun trick and it freaks out some people if they've never seen it before. Published 12/07/24
Kill Hunters in Halo 7/22/39|Have you ever gotten surrounded or intimidated by the Covenant Hunters in Halo with not a rocket to spare? Well, here's a simple way to kill them which only takes a little practice written 07/22/39
Know if Your Friend Screens During Halo 07/26/19|Want to catch your friend screening in Halo 2? These tips will help you catch him in the act of screening (also known as screen hacking, screen looking, and screen peeking) posted 07/26/19
October '34 join a Clan in Halo| Joining a clan in Halo is a very good way to meet new people and get into some competitive games. created 10/04/2034
Feb '21 kill Someone with a Sword from a Warthog on the Other Side of a Map in Halo|"written 02/22/2021 If you have a friend to play with it'll look funny as Master Chief will seem to "" moonwalk "" through the whole map. "
Get to Staunton Island or Shoreside Vale in Grand Theft Auto III Aug '28| Have you not yet unlocked Liberty City's Staunton Island or Shoreside Vale? Here's how you can get there early! Written 08/24/2028
Kill a Hunter in Halo 1, 2, 3, 3 Odst, or Reach Aug '28| Hey there! Have you been in a firefight with Hunters? This is the place for Halo noobs that are always killed by Hunters. Written 08/24/2028
Get Grand Theft Auto: Vice City 9/06/10|released 09/06/10 when Grand Theft Auto: Vice City was released way back in 2002, it immediately changed the way open-world and free-roaming games were played, and had set new standards when it comes to video games during that time.
10/27/22 find an FBI Rancher in Grand Theft Auto: Vice City|published 10/27/22 there are a wide variety of vehicles in Grand Theft Auto: Vice City, but some are harder to come by than others. One of the hardest vehicles to obtain is the FBI Rancher, a high-performance black SUV.
Enjoy a Grand Theft Auto Game as a Beginner 1/23/38|published 01/23/38 if you're reading this article, you're probably new to the Grand Theft Auto games, or even video games in general. It can be hard to play the Grand Theft Auto games as a beginner, but this article will help you!
Fly Helicopters in GTA 07/16/22|Starting from GTA: Vice City to the latest version of the game (GTA 5), players are able to pilot helicopters and fly them around the city. These vehicles are very efficient when you need to get from one point in the city to another without having to go through tight streets and traffic published 07/16/22
Fly Planes in GTA 07/16/22|Planes take you wherever you need to go, and they do it fast. You dont have to go through traffic-jammed streets or cut through the city through narrow shortcuts just to get you quickly where you need to be published 07/16/22
Mod a Halo Game September '00|released 09/06/2000 the PC version of Halo can use several downloadable modifications, or mods, to change or improve gameplay. These mods are often created by fellow users and allow you to amp up your gaming experience by providing more choices than ever before.
Get Money on Grand Theft Auto Games Without Cheats 2008 April|written 04/23/2008 Those of us who had played Grand Theft Auto games usually resorts to cheats because it helps make the game more easier or sometimes funner. 
Get a Military Jet in GTA Online Nov 3|Military jets are one of the most powerful and effective vehicles in Grand Theft Auto Online. It lets player travel across the entire state of San Andreas fast, and it has built in weapons to protect you from other attackers Written 11/03/32
Create a Server on Vice City Multi Player May 2027| Creating a server in Vice City: Multiplayer is fun and easy. However, becoming a server admin also requires that you watch and maintain your server. published 05/05/2027
Swim Underwater in GTA San Andreas 4/7/16|On the earlier versions of Grand Theft Auto, the main character could only drive, run, or walkthats about it. If the player accidentally ran into any water, the character immediately died or became wasted. Published 04/07/16
05/27/14 earn Money Quickly in GTA for PC|written 05/27/14 racking up the dollars is very vital if you want to take over the streets and become the top gangster in GTA. This has made earning money a central aspect of the game ever since its first release.
05/27/14 complete 50 Gang Wars in Grand Theft Auto IV: The Lost and Damned|"written 05/27/14 gang Wars are a side activity on Grand Theft Auto IV's DLC, The Lost and Damned. An achievement/trophy ""Full Chat"" is awarded to you if you have raised Terry and Clays toughness level to 100% each through missions and Gang Wars, and weapons are unlocked in your safehouse as you complete more and more Gang Wars, but enemies will be stronger as you progress."
2008 Jan download Grand Theft Auto|Grand Theft Auto has always been sold and bought on a disk installer by Rockstar Games. However, recent improvements in technology have made the GTA game franchise available on digital media created 01/17/2008
"Christmas 2025 start off in ""Grand Theft Auto San Andreas"" (Xbox)"|created 2026 new year's day some may find it difficult to start off the game in San Andreas, after Officer Tenpenny drops you off in Balla's territory. The beginning can feel cold and weird, if you never played this before.
November '08 buy Properties in GTA for PC|Posted 11/05/2008 modern GTA games are becoming more and more packed with features. Moving past the pure street chaos and killing focus of the earlier GTA games, newer GTA versions have evolved to include buying properties.
Mar '05 buy Weapons in GTA for PC|released 03/11/2005 grand Theft Auto is a game of street chaos, with fast paced cars and intense shoot outs. It is a game that leaves any gamer on the edge of their seat.
Mar '05 start a Rampage in GTA San Andreas|released 03/11/2005 So, you are bored and have nothing to do in GTA San Andreas? For a kick, just cause a rampage! This wikiHow will help you. 
Start a Gang in Grand Theft Auto: San Andreas July 20|Grand Theft Auto: San Andreas is one of the classic GTA games playable on multiple platforms. In the game, you can start a gang and recruit gang members to assist you in carrying out missions, and they will help you attack your enemies written 07/09/
Start a Perfect Riot in Grand Theft Auto: San Andreas end of last year current date: 5/18/2044|Published 09/01/43 there are many exciting things to do in San Andreas. But the best way to generate the most excitement and action in the game is when the whole state of San Andreas is rioting and looting and killing like crazy.
Roleplay on San Andreas Multiplayer end of last year current date: 5/18/2044|Published 09/01/43 If you're new to San Andreas Multiplayer or new to the roleplaying side, this article is for you! 
July 2001 play Grand Theft Auto: San Andreas Multiplayer|Though the 2004 multi-platform smash hit Grand Theft Auto: San Andreas was originally sold as a purely single-player title, thanks to the ingenuity of independent modders, it's now possible to play the game with online multiplayer Written 07/02/2001
Jun of 2040 start a Fire in Grand Theft Auto: San Andreas|published 06/10/2040 Learn how to start 5 kinds of fires In GTA:SA. 
Play GTA San Andreas Without Resorting to Cheats 09/16/29|If you are a true gamer, you wouldn't even think about using cheats! San Andreas is more difficult than the past Grand Theft Auto games, but it is still possible to complete without cheating released 09/16/29
Pass the Tough Missions in Grand Theft Auto San Andreas 09/16/29|Do you want to know how to easily beat one of those missions in San Andreas that seemed so difficult? Do you want to finish the game, or get 100%, or to complete the game without any cheats released 09/16/29
August '48 install Grand Theft Auto: San Andreas|"released 08/17/2048 grand Theft Auto: San Andreas is the second sequel to the seminal Grand Theft Auto 3. In GTA: San Andreas, players play as Carl ""CJ"" Johnson, a young gangster trying to navigate the wild world of San Andreas, a satirical state modeled on early 90's California."
Make People Fight in Grand Theft Auto: San Andreas 9/2/26| You can make pedestrians come and start attacking you. This is a good way to take their weapons and cash. written 09/02/26
Install Car Mods in Grand Theft Auto San Andreas March '42|There are thousands of car mods available for Grand Theft Auto: San Andreas, and they can be easily installed with the San Andreas Mod Installer. Once you've downloaded a few mod files, you can use the Mod Installer to add them to GTA with just a few clicks Written 03/01/2042
Have a Dog Fight in Grand Theft Auto: San Andreas August 8|created 08/09/ Having Dog fights are pretty cool, but in GTA SA they can be pretty hard to come across. 
2040 Feb unlock Interiors in Grand Theft Auto IV| This will show you how to enter interiors in Multiplayer of Grand Theft Auto IV released 02/23/2040
09/5/38 go Through the Construction Zones in GTA San Andreas|Okay, we all know you can fly over to the other side, but this is a way to go through the construction zones. This is for the PS2 version of GTA: San Andreas Created 09/05/38
Jun '36 play LCPDFR|Posted 06/19/2036 joining the Liberty City Police Department (LCPD) in Grand Theft Auto (GTA) IV can enhance your gameplay if youre interested in playing the game as a policeman instead of as a criminal.
Start a Rampage in Grand Theft Auto IV 11/3/48|written 11/03/48 Getting 6 stars has been a past time and hobby so far in Grand Theft Auto IV. It's also fun while you're not doing missions or you are just bored! 
Save in Grand Theft Auto 11/3/48|written 11/03/48 grand Theft Auto 4 provides easy ways to save your game. This open-world sandbox-type game has an expansive game world, and it can be daunting to start over when you die and havent saved.
Play Grand Theft Auto IV Online 2049 August|Grand Theft Auto 4 (GTA 4) is an action/sandbox video game that can be played on Xbox 360, Playstation 3, and PC. Beginners often have trouble figuring out how to play GTA 4 online since it is not fully introduced to you at the beginning of the game written 08/23/2049
Start a Massacre on Grand Theft Auto IV 2049 August| You have just got a copy of Grand Theft Auto 4 and you want to start a massacre. written 08/23/2049
See the Beating Heart in the Statue of Happiness in GTA IV Nov of 2006|The GTA series is loaded with easter eggs. Sometimes you can find these by yourself, but other times you need the help of the Internet. The beating heart of the Statue of Happiness in GTA IV is a well hidden easter egg that can easily be found if you follow these steps written 11/14/2006
Play GTA IV Realistically 2011 April|written 04/24/2011 do you want to play GTA IV but you don't want to go through killing sprees, police chases, and committing crimes? Why not play it like a normal Liberty City resident?
Jan 12 make Niko Wear Claude from GTA 3's Clothes in GTA | Have you ever wanted Niko to wear GTA 3's Claude Speed's clothes? Here is how. WARNING CONTAINS SPOILERS created 01/04/31
